{
  "ticker": "PATH",
  "date": "2026-06-01",
  "generated": "2026-06-01T21:32:00-04:00",
  "bias": "RANGE",
  "conviction": 0.55,
  "horizon": "1-4w",
  "spot_reference": 13.11,
  "thesis": "PATH gapped +12% on a genuine Q1 earnings beat into a dealer long-gamma box (GEX +18.1M, $13 pin, every near-expiry max-pain $11) [STRUCT:gex][STRUCT:max_pain] while the lit tape is two-sided (net +$2.18M, loudest print a $2.31M protective ATM put) [FLOW:unusual_volume] and bullish_flow backtests edge-negative (44.4% win, -1.25% avg) [HIST:signal_backtest]. Real dark-pool accumulation (buy_ratio 0.634, VWAP $12.89) and a profitability inflection [DP:block_stratified][FUND:operatingMarginTTM] underpin a floor, but the Street is cutting targets to ~spot and the debate disconfirmed the directional long (bull 0.55 < bear 0.65) [DEBATE]. Trade as a defined-risk premium-selling RANGE ($12-$15, pin $13) into the post-earnings IV crush at starter size, flip-long only on a hold >$15.",
  "entries": {
    "primary": { "price": 13.25, "trigger": "sell the iron condor near the $13 gamma pin as post-earnings IV crushes", "source": "[STRUCT:gex]" },
    "aggressive": { "price": 14.0, "trigger": "leg in the call side into a squeeze spike to the $14 first resistance", "source": "[OI:oi_by_strike]" },
    "fade": { "price": 15.0, "trigger": "break-and-hold >$15 flips to the bull call-debit tail; lose <$11.70 leans toward $11 max-pain", "source": "[OI:oi_by_strike]" }
  },
  "levels": { "support": 12.89, "resistance": 15.0, "gamma_flip": 8.1, "largest_pin": 11.0 },
  "invalidation": {
    "price": "two daily closes >$15.00 (squeeze, range wrong up) OR two daily closes <$11.70 (loses DP support, max-pain $11 gravity)",
    "signal": "GEX regime flips NEGATIVE on phase-4 refresh OR insights institutional-accumulation flips to distribution (buy/sell <1.0) [INSIGHT:institutional_accumulation]",
    "macro": "hawkish/dovish FOMC surprise 2026-06-16/17 gaps PATH beyond the +/-6.32% expected move and breaches a short strike [MACRO:FOMC_2026-06-17]"
  },
  "sizing": {
    "p_raw": 0.444,
    "p": 0.444,
    "win_rate_n": 9,
    "win_rate_source": "backtest",
    "payoff_b": 1.67,
    "raw_kelly": 0.111,
    "fraction": 0.25,
    "cap_pct": 5.0,
    "final_size_pct": 0.5,
    "deviation_reason": null
  },
  "structures": [
    {
      "kind": "directional",
      "type": "call debit spread (watch-only / squeeze-tail)",
      "strikes": "13/15",
      "expiry": "2026-07-17",
      "debit_credit": 0.75,
      "breakeven": 13.75,
      "max_loss": 0.75,
      "note": "starter/skip only: p=0.444<0.50 and debate disconfirmed the long; play only as the plan-B flip if price holds >$15 (31% short squeeze tail through the $15 wall)"
    },
    {
      "kind": "defined_risk",
      "type": "iron condor (recommended)",
      "strikes": "11P/12P/15C/16C",
      "expiry": "2026-06-18",
      "debit_credit": 0.30,
      "breakeven": "11.70 / 15.30",
      "max_loss": 0.70,
      "note": "sells the $12-$15 range into the post-earnings IV crush + max-pain $11 pin; shorts beyond the +/-6.32% expected move so a single FOMC-day gap does not breach; sized to 0.5% of book on max-loss"
    }
  ],
  "gates": {
    "fundamentals": "CONFIRM",
    "sentiment": "CAUTION",
    "crowd_state": "CROWDED_SHORT",
    "correlation_cluster": null,
    "sector_rotation": "aligned",
    "debate_disconfirmed": true
  },
  "context": {
    "unusual_verdict": "GENUINELY_UNUSUAL",
    "universe_rank_net_dir": "outside top-50 abs$; 98th universe pctile [DUCKDB]",
    "iv_rank": 53.3,
    "self_pctile_net_dir": 100.0
  },
  "expected_move": {
    "front_expiry_pct": 6.32,
    "front_expiry_abs": 0.83,
    "source": "[CTX:implied_move_pct]"
  },
  "macro": {
    "net": "mixed",
    "tailwinds": [
      "[MACRO:sector_flow_2026-06-01] Technology #1 net-inflow sector, persistence 1, accelerating",
      "[MACRO:CPILFESL_2026-04] core CPI 2.74% disinflating supports the cutting cycle",
      "[MACRO:DFF_2026-05-29] Fed funds 3.62% easing"
    ],
    "headwinds": [
      "[MACRO:DGS10_2026-05-29] 10y at 4.45% pressures long-duration growth multiples",
      "[MACRO:MarketRegime_2026-06-01] breadth 40%, TRANSITIONAL regime -> half size, defined-risk"
    ]
  },
  "catalysts": [
    { "date": "2026-06-05", "event": "weekly OPEX (gamma pin $13)", "impact": "?" },
    { "date": "2026-06-17", "event": "FOMC + dot plot/SEP", "impact": "?" },
    { "date": "2026-06-18", "event": "monthly OPEX cliff (max-pain $11, 110k OI)", "impact": "?" },
    { "date": "2026-09-03", "event": "next earnings Q2 FY27 (outside 30d)", "impact": "?" }
  ],
  "key_risks": [
    "squeeze override: 31% short float + Tech bid breaks and holds >$15, loss on the condor call side [SENT:short_float]",
    "post-earnings fade to max-pain $11 (negative vanna IV crush, Street target cuts to $13-15, $35M fund exit) breaches the put side [STRUCT:max_pain]",
    "FOMC 6/16-17 gap coincident with Jun-18 OPEX beyond the +/-6.32% expected move [MACRO:FOMC_2026-06-17]",
    "no directional edge: bullish_flow backtest 44.4% (n=9, avg -1.25%) and debate disconfirmed (bull 0.55 < bear 0.65) [HIST:signal_backtest][DEBATE]"
  ],
  "citations": [
    "[STRUCT:gex] GEX +18.1M POSITIVE, ZGL $8.10, $13 gamma pin",
    "[STRUCT:max_pain] every near-expiry max-pain = $11 (Jun-5/12/18)",
    "[HIST:signal_backtest] bullish_flow win_rate 0.444 (n=9, avg -1.25%)",
    "[DP:block_stratified] large-tier buy_ratio 0.634, +4.6M sh accumulation, VWAP $12.89",
    "[FUND:operatingMarginTTM] first GAAP operating profit (op margin -22%->+6%), CONFIRM",
    "[MACRO:sector_flow_2026-06-01] Technology #1 inflow, persistence 1",
    "[DEBATE] bull_residual 0.55 < bear_residual 0.65 -> disconfirmed"
  ],
  "confluence_score": 42,
  "recommended_bin": 0.55,
  "paths": { "plan": "phase-9-trade-plan.md", "audit": "phase-10-audit.md" },
  "disclaimer": "For research and educational use only. Not financial advice. Sizing and structures are illustrative."
}
